{
  "kind": "infrawright.source_provenance",
  "openapi": null,
  "provider": {
    "files": [
      {
        "path": "internal/fixture/runtime.go",
        "sha256": "65ed2b2a867720b473c76f5f8ead104b9532ea13dcece4068460b709b228b888"
      },
      {
        "path": "provider.go",
        "sha256": "79fff59e478c19c478c7d0d471ce90793360871464b2d282a565df17c75a2ea8"
      },
      {
        "path": "resource_ambiguous.go",
        "sha256": "815b4d88e059c1c8d5cc5a43c8645d7e2606de6fad0f3cf4fb818e279a5592a1"
      },
      {
        "path": "resource_direct_http.go",
        "sha256": "e713ca339e6d1618557f3c5d6713c9ed73981b29e4de3d77ba8b06611a36e652"
      },
      {
        "path": "resource_dynamic.go",
        "sha256": "58192dc424e8fde9b519e252ea92e6822dbf7a448a5f54b5cfda9e99560b5a0a"
      },
      {
        "path": "resource_sdk_http.go",
        "sha256": "c4cc1f34c1c0279f9b4a8c35dfdde67ab8ce4205d37318bb7e728a4becd92259"
      },
      {
        "path": "resource_sdk_symbol.go",
        "sha256": "cc10da03b3f7b185948b4ec326e9ba87427b0534d246980a4ea827baa32550df"
      },
      {
        "path": "resource_unresolved.go",
        "sha256": "fd6efaaf14cdb3db7c2a21b37d20445363badc124de03e068a410b9db946e8e8"
      }
    ],
    "module_path": "example.invalid/terraform-provider-sourcefirst",
    "repository": "fixture/sourcefirst-provider",
    "revision": "c37dc3c4bdd98adf61862e76d67803469bd5b35d",
    "tree_sha256": "d8088f0de778b1a689dc78d20797a1fde5fd7db2fbf01e145d272d1a03257ce6"
  },
  "provider_module": {
    "go_mod": {
      "path": "go.mod",
      "sha256": "76469f905711de518637fa0daf8f5acdfc7a3959086925bb4c08a191e2eb72cc"
    },
    "go_sum": null,
    "local_replaces": [
      {
        "local_path": "../sdk",
        "module_path": "example.invalid/sourcefirst-sdk",
        "module_version": null
      }
    ]
  },
  "schema_version": 1,
  "sdks": [
    {
      "files": [
        {
          "path": "alpha/client.go",
          "sha256": "7cbff5bf7e2d575b678baa4e76575785993d719fcfbe352169af162c9941f213"
        },
        {
          "path": "beta/client.go",
          "sha256": "84e5d499e30b67340f9b5ebe82825b08a0287a849d1df01df7bd2644ff88e98c"
        },
        {
          "path": "catalog/catalog.go",
          "sha256": "8344c8f69718977bd3a4097bd6a4e107853c8e3c412597f7a6b83e87a942e6b7"
        },
        {
          "path": "go.mod",
          "sha256": "076d79d19843c6770551e49b253ab91a104c1b4724e3db74634fd291a07bab07"
        },
        {
          "path": "opaque/opaque.go",
          "sha256": "7d2445b1900707ee98a5fbd2c4619d48a5c07143302e069f76bb42325875047a"
        }
      ],
      "module_path": "example.invalid/sourcefirst-sdk",
      "module_version": "v0.0.0",
      "repository": "fixture/sourcefirst-sdk",
      "revision": null,
      "tree_sha256": "06068ec6c7370d83eefab54b9a7679dd513a3e01a31301b4bd220640a6e35737"
    }
  ],
  "selection": {
    "filters": [
      {
        "name": "reviewed_not_applicable",
        "values": [
          "sourcefirst_not_applicable"
        ]
      }
    ],
    "resource_types": [
      "sourcefirst_ambiguous",
      "sourcefirst_direct_http",
      "sourcefirst_dynamic",
      "sourcefirst_no_source",
      "sourcefirst_not_applicable",
      "sourcefirst_sdk_http",
      "sourcefirst_sdk_symbol",
      "sourcefirst_unresolved"
    ]
  },
  "terraform_schema": {
    "path": "provider-schema.json",
    "sha256": "4f25680ef6ec3e8d6014e4683edb1e3c47cf54b5c7a0299af7b21ce4a85bfbe3"
  }
}
